{
    "$schema": "http://json-schema.org/draft-04/schema#",
    "id": "https://schema.backbrace.io/pageMeta.json",
    "title": "Page meta data.",
    "type": "object",
    "properties": {
        "name": {
            "description": "Name of the page.",
            "type": "string"
        },
        "caption": {
            "description": "Caption of the page.",
            "type": "string"
        },
        "component": {
            "description": "Component for the whole page (defaults to `cardpage`).",
            "type": "string"
        },
        "controller": {
            "description": "Page controller.",
            "type": "string"
        },
        "tableName": {
            "description": "Name of the page's datasource.",
            "type": "string"
        },
        "icon": {
            "description": "Icon to use for the page.",
            "type": "string",
            "$ref": "icons.json"
        },
        "filters": {
            "description": "Filters for the page",
            "type": "string"
        },
        "sections": {
            "description": "Page sections.",
            "type": "array",
            "items": {
                "$ref": "#/definitions/pageSectionMeta"
            }
        }
    },
    "required": [
        "sections"
    ],
    "definitions": {
        "pageFieldMeta": {
            "description": "Page field meta data.",
            "type": "object",
            "properties": {
                "name": {
                    "description": "Name of the field.",
                    "type": "string"
                },
                "caption": {
                    "description": "Caption of the field.",
                    "type": "string"
                },
                "type": {
                    "description": "Data type for the field.",
                    "type": "string",
                    "$ref": "datatypes.json"
                },
                "component": {
                    "description": "Custom component to use for the field.",
                    "type": "string"
                },
                "width": {
                    "description": "Width of the field. Defaults to `100px`.",
                    "type": "string"
                },
                "hidden": {
                    "description": "Don't display the field on the page.",
                    "type": "boolean"
                },
                "editable": {
                    "description": "Readonly field.",
                    "type": "boolean"
                },
                "className": {
                    "description": "Classes to add to the field.",
                    "type": "string"
                }
            },
            "required": [
                "name"
            ]
        },
        "pageActionMeta": {
            "description": "Page action meta data.",
            "type": "object",
            "properties": {
                "name": {
                    "description": "Name of the action.",
                    "type": "string"
                },
                "text": {
                    "description": "Caption of the action.",
                    "type": "string"
                },
                "icon": {
                    "description": "Icon to use on the button.",
                    "type": "string",
                    "$ref": "icons.json"
                },
                "iconColor": {
                    "description": "Icon color. Defaults to header color.",
                    "type": "string"
                },
                "className": {
                    "description": "Classes to add to the button.",
                    "type": "string"
                }
            },
            "required": [
                "name"
            ]
        },
        "pageSectionMeta": {
            "description": "Page section meta data.",
            "type": "object",
            "properties": {
                "name": {
                    "description": "Name of the section.",
                    "type": "string"
                },
                "text": {
                    "description": "Caption of the section.",
                    "type": "string"
                },
                "pageName": {
                    "description": "Display a subpage in this section.",
                    "type": "string"
                },
                "icon": {
                    "description": "Section icon.",
                    "type": "string",
                    "$ref": "icons.json"
                },
                "className": {
                    "description": "Classes to add to the section.",
                    "type": "string"
                },
                "fields": {
                    "description": "Page section fields.",
                    "type": "array",
                    "items": {
                        "$ref": "#/definitions/pageFieldMeta"
                    }
                },
                "actions": {
                    "description": "Page actions.",
                    "type": "array",
                    "items": {
                        "$ref": "#/definitions/pageActionMeta"
                    }
                }
            },
            "required": [
                "name"
            ]
        }
    }
}