{
    "$schema": "../../../node_modules/@backbrace/devkit/schema/pagemeta.json",
    "name": "API List",
    "tableName": "table/modules",
    "component": "templatepage",
    "controller": "controllers/apihome.js",
    "sections": [
        {
            "name": "footer",
            "pageName": "page/footer"
        }
    ]
}