{
    "$schema": "../../../node_modules/@backbrace/devkit/schema/pagemeta.json",
    "name": "index",
    "tableName": "table/tutorials",
    "component": "templatepage",
    "controller": "controllers/guide.js",
    "sections": [
        {
            "name": "footer",
            "pageName": "page/footer"
        }
    ]
}